{"appRelease":{"build":"1","embeddedMeasurementStackSHA256":"a92a208324af0ea85c092e1cf04248c669f01c588c9f0d0b724e4c40a1014642","sourceRevision":"821a7c22d68d118ae839ee883d54c7d1a029a5c185d8f06a85b255bf7f2b714f","version":"2.0.0"},"artifacts":[],"createdAt":"2026-07-23T20:36:39.504Z","device":{"machineIdentifier":"iPhone15,3","osBuild":"23F84","osVersion":"iOS 26.5.2"},"environment":{"batteryLevelAtStart":0.6000000238418579,"batteryStateAtStart":"unplugged","lowPowerModeAtStart":false,"thermalAssistance":"none","thermalStateAtEnd":"nominal","thermalStateAtStart":"nominal"},"model":{"artifactID":"mlx-community/Llama-3.2-1B-Instruct-4bit","artifactRevision":"08231374eeacb049a0eade7922910865b8fce912","format":"MLX Safetensors","parameterCount":1235814400,"quantization":"4-bit-group-size-64","registryEntryID":"mlx-community--llama-3.2-1b-instruct-4bit--08231374","registryEntrySHA256":"282b2b5890529c2281888cbc6f432bd846bc0d2874a692fc0cedd71d458f2020"},"payload":{"attempts":[{"endedAt":"2026-07-23T20:36:41.021Z","failure":null,"generatedText":"When the device is offline again, the private note is automatically synced to the cloud. Once connectivity returns, the private note will be available on the cloud and can be accessed from anywhere.","index":0,"memory":{"peakPhysicalFootprintBytes":904611432,"samples":[{"elapsedNanoseconds":3458,"physicalFootprintBytes":809797176},{"elapsedNanoseconds":170250,"physicalFootprintBytes":809797176},{"elapsedNanoseconds":53885083,"physicalFootprintBytes":810092088},{"elapsedNanoseconds":107294708,"physicalFootprintBytes":810632760},{"elapsedNanoseconds":160201041,"physicalFootprintBytes":810649144},{"elapsedNanoseconds":213601708,"physicalFootprintBytes":810649144},{"elapsedNanoseconds":263822916,"physicalFootprintBytes":810845752},{"elapsedNanoseconds":317215958,"physicalFootprintBytes":813254200},{"elapsedNanoseconds":368501458,"physicalFootprintBytes":813254200},{"elapsedNanoseconds":421951083,"physicalFootprintBytes":813352504},{"elapsedNanoseconds":473032208,"physicalFootprintBytes":813401656},{"elapsedNanoseconds":526400583,"physicalFootprintBytes":813499960},{"elapsedNanoseconds":579789916,"physicalFootprintBytes":813631032},{"elapsedNanoseconds":630215125,"physicalFootprintBytes":833504872},{"elapsedNanoseconds":682879041,"physicalFootprintBytes":863471208},{"elapsedNanoseconds":736464250,"physicalFootprintBytes":881034856},{"elapsedNanoseconds":789892750,"physicalFootprintBytes":902350440},{"elapsedNanoseconds":842275666,"physicalFootprintBytes":902547048},{"elapsedNanoseconds":895709208,"physicalFootprintBytes":904529512},{"elapsedNanoseconds":947757583,"physicalFootprintBytes":904529512},{"elapsedNanoseconds":1000817500,"physicalFootprintBytes":904529512},{"elapsedNanoseconds":1053222041,"physicalFootprintBytes":904545896},{"elapsedNanoseconds":1103564791,"physicalFootprintBytes":904562280},{"elapsedNanoseconds":1157003083,"physicalFootprintBytes":904578664},{"elapsedNanoseconds":1210479125,"physicalFootprintBytes":904578664},{"elapsedNanoseconds":1260833791,"physicalFootprintBytes":904578664},{"elapsedNanoseconds":1313787458,"physicalFootprintBytes":904578664},{"elapsedNanoseconds":1367182958,"physicalFootprintBytes":904595048},{"elapsedNanoseconds":1418146791,"physicalFootprintBytes":904611432},{"elapsedNanoseconds":1471551583,"physicalFootprintBytes":904611432},{"elapsedNanoseconds":1491325833,"physicalFootprintBytes":904611432}]},"monotonic":{"clock":"continuous-clock","completedNanoseconds":1491359333,"decodeNanoseconds":594070333,"firstRenderableNanoseconds":867741125,"firstTokenNanoseconds":867159125,"promptEvaluationNanoseconds":864207864,"requestAcceptedNanoseconds":0},"outcome":"succeeded","phase":"warmup","startedAt":"2026-07-23T20:36:39.529Z","thermal":{"end":"nominal","start":"nominal","transitions":[]},"tokenCounts":{"input":79,"output":37},"tokenEvents":[{"decodedAtNanoseconds":867741125,"decodedPrefix":"When","index":0,"isRenderable":true,"isSpecial":false,"receivedNanoseconds":867159125,"tokenID":4599},{"decodedAtNanoseconds":null,"decodedPrefix":null,"index":1,"isRenderable":null,"isSpecial":null,"receivedNanoseconds":883736333,"tokenID":279},{"decodedAtNanoseconds":null,"decodedPrefix":null,"index":2,"isRenderable":null,"isSpecial":null,"receivedNanoseconds":900077250,"tokenID":3756},{"decodedAtNanoseconds":null,"decodedPrefix":null,"index":3,"isRenderable":null,"isSpecial":null,"receivedNanoseconds":916463625,"tokenID":374},{"decodedAtNanoseconds":null,"decodedPrefix":null,"index":4,"isRenderable":null,"isSpecial":null,"receivedNanoseconds":932553583,"tokenID":27258},{"decodedAtNanoseconds":null,"decodedPrefix":null,"index":5,"isRenderable":null,"isSpecial":null,"receivedNanoseconds":949101916,"tokenID":1578},{"decodedAtNanoseconds":null,"decodedPrefix":null,"index":6,"isRenderable":null,"isSpecial":null,"receivedNanoseconds":965218458,"tokenID":11},{"decodedAtNanoseconds":null,"decodedPrefix":null,"index":7,"isRenderable":null,"isSpecial":null,"receivedNanoseconds":981691625,"tokenID":279},{"decodedAtNanoseconds":null,"decodedPrefix":null,"index":8,"isRenderable":null,"isSpecial":null,"receivedNanoseconds":997890291,"tokenID":879},{"decodedAtNanoseconds":null,"decodedPrefix":null,"index":9,"isRenderable":null,"isSpecial":null,"receivedNanoseconds":1014161291,"tokenID":5296},{"decodedAtNanoseconds":null,"decodedPrefix":null,"index":10,"isRenderable":null,"isSpecial":null,"receivedNanoseconds":1030538625,"tokenID":374},{"decodedAtNanoseconds":null,"decodedPrefix":null,"index":11,"isRenderable":null,"isSpecial":null,"receivedNanoseconds":1046913541,"tokenID":9651},{"decodedAtNanoseconds":null,"decodedPrefix":null,"index":12,"isRenderable":null,"isSpecial":null,"receivedNanoseconds":1063259583,"tokenID":86128},{"decodedAtNanoseconds":null,"decodedPrefix":null,"index":13,"isRenderable":null,"isSpecial":null,"receivedNanoseconds":1079608500,"tokenID":311},{"decodedAtNanoseconds":null,"decodedPrefix":null,"index":14,"isRenderable":null,"isSpecial":null,"receivedNanoseconds":1095944583,"tokenID":279},{"decodedAtNanoseconds":null,"decodedPrefix":null,"index":15,"isRenderable":null,"isSpecial":null,"receivedNanoseconds":1112486666,"tokenID":9624},{"decodedAtNanoseconds":null,"decodedPrefix":null,"index":16,"isRenderable":null,"isSpecial":null,"receivedNanoseconds":1129090250,"tokenID":13},{"decodedAtNanoseconds":null,"decodedPrefix":null,"index":17,"isRenderable":null,"isSpecial":null,"receivedNanoseconds":1145712916,"tokenID":9843},{"decodedAtNanoseconds":null,"decodedPrefix":null,"index":18,"isRenderable":null,"isSpecial":null,"receivedNanoseconds":1161983916,"tokenID":31357},{"decodedAtNanoseconds":null,"decodedPrefix":null,"index":19,"isRenderable":null,"isSpecial":null,"receivedNanoseconds":1178491958,"tokenID":4780},{"decodedAtNanoseconds":null,"decodedPrefix":null,"index":20,"isRenderable":null,"isSpecial":null,"receivedNanoseconds":1194799375,"tokenID":11},{"decodedAtNanoseconds":null,"decodedPrefix":null,"index":21,"isRenderable":null,"isSpecial":null,"receivedNanoseconds":1211208208,"tokenID":279},{"decodedAtNanoseconds":null,"decodedPrefix":null,"index":22,"isRenderable":null,"isSpecial":null,"receivedNanoseconds":1227550333,"tokenID":879},{"decodedAtNanoseconds":null,"decodedPrefix":null,"index":23,"isRenderable":null,"isSpecial":null,"receivedNanoseconds":1244146875,"tokenID":5296},{"decodedAtNanoseconds":null,"decodedPrefix":null,"index":24,"isRenderable":null,"isSpecial":null,"receivedNanoseconds":1260636541,"tokenID":690},{"decodedAtNanoseconds":null,"decodedPrefix":null,"index":25,"isRenderable":null,"isSpecial":null,"receivedNanoseconds":1277135416,"tokenID":387},{"decodedAtNanoseconds":null,"decodedPrefix":null,"index":26,"isRenderable":null,"isSpecial":null,"receivedNanoseconds":1293480000,"tokenID":2561},{"decodedAtNanoseconds":null,"decodedPrefix":null,"index":27,"isRenderable":null,"isSpecial":null,"receivedNanoseconds":1310394708,"tokenID":389},{"decodedAtNanoseconds":null,"decodedPrefix":null,"index":28,"isRenderable":null,"isSpecial":null,"receivedNanoseconds":1326806291,"tokenID":279},{"decodedAtNanoseconds":null,"decodedPrefix":null,"index":29,"isRenderable":null,"isSpecial":null,"receivedNanoseconds":1343278000,"tokenID":9624},{"decodedAtNanoseconds":null,"decodedPrefix":null,"index":30,"isRenderable":null,"isSpecial":null,"receivedNanoseconds":1359750375,"tokenID":323},{"decodedAtNanoseconds":null,"decodedPrefix":null,"index":31,"isRenderable":null,"isSpecial":null,"receivedNanoseconds":1376410833,"tokenID":649},{"decodedAtNanoseconds":null,"decodedPrefix":null,"index":32,"isRenderable":null,"isSpecial":null,"receivedNanoseconds":1392802291,"tokenID":387},{"decodedAtNanoseconds":null,"decodedPrefix":null,"index":33,"isRenderable":null,"isSpecial":null,"receivedNanoseconds":1409348041,"tokenID":25790},{"decodedAtNanoseconds":null,"decodedPrefix":null,"index":34,"isRenderable":null,"isSpecial":null,"receivedNanoseconds":1425833875,"tokenID":505},{"decodedAtNanoseconds":null,"decodedPrefix":null,"index":35,"isRenderable":null,"isSpecial":null,"receivedNanoseconds":1443548000,"tokenID":12660},{"decodedAtNanoseconds":null,"decodedPrefix":null,"index":36,"isRenderable":null,"isSpecial":null,"receivedNanoseconds":1461229458,"tokenID":13}]},{"endedAt":"2026-07-23T20:36:41.858Z","failure":null,"generatedText":"When the device is offline again, the private note is automatically synced to the cloud. Once connectivity returns, the private note will be available on the cloud and can be accessed from anywhere.","index":1,"memory":{"peakPhysicalFootprintBytes":904693352,"samples":[{"elapsedNanoseconds":2416,"physicalFootprintBytes":904611432},{"elapsedNanoseconds":129625,"physicalFootprintBytes":904611432},{"elapsedNanoseconds":51952000,"physicalFootprintBytes":904660584},{"elapsedNanoseconds":103909250,"physicalFootprintBytes":904676968},{"elapsedNanoseconds":157376875,"physicalFootprintBytes":904676968},{"elapsedNanoseconds":209303500,"physica